event_id,title_tr,title_en,description_tr,description_en,short_description_tr,short_description_en,category,subcategory,price_min,price_max,currency,start_date,end_date,venue_name,venue_address,city,country,latitude,longitude,image_url,cover_image_id,gallery_image_ids,ticket_url,organizer_name,organizer_contact,source_platform,source_id,source_url,is_featured,is_active,view_count,like_count,tags,metadata,created_at,updated_at
sezen_aksu_concert_2024,Sezen Aksu Konseri - İstanbul,Sezen Aksu Concert - Istanbul,Türk pop müziğinin kraliçesi Sezen Aksu büyüleyici şarkılarıyla İstanbul'da hayranlarıyla buluşuyor. 40 yıllık kariyerinin en sevilen şarkılarını seslendirecek.,The queen of Turkish pop music Sezen Aksu meets her fans in Istanbul with her enchanting songs. She will perform the most beloved songs of her 40-year career.,Sezen Aksu'nun unutulmaz İstanbul konseri,Sezen Aksu's unforgettable Istanbul concert,music,pop,150.00,500.00,TRY,2024-06-15 20:00:00,2024-06-15 23:00:00,Volkswagen Arena,Küçükçekmece/İstanbul,İstanbul,Turkey,41.0082,28.9784,,7,"{7}",https://www.biletix.com/etkinlik/sezen-aksu,Biletix,info@biletix.com,biletix,BX2024001,https://www.biletix.com/etkinlik/sezen-aksu,true,true,1250,89,"{""müzik"",""pop"",""konser"",""sezen-aksu"",""türkçe-pop""}","{""seating_plan"": true, ""accessibility"": true, ""parking"": true, ""age_limit"": ""0+"", ""duration"": ""180 minutes"", ""sound_system"": ""Dolby Atmos""}",2024-01-15 13:00:00,2024-01-15 13:00:00
hamlet_devlet_tiyatrosu,Hamlet - İstanbul Devlet Tiyatrosu,Hamlet - Istanbul State Theater,Shakespeare'in ölümsüz eseri Hamlet modern yorumuyla İstanbul Devlet Tiyatrosu sahnesinde. Yönetmen Ahmet Levendoğlu'nun yorumuyla klasik eserin çağdaş uyarlaması.,Shakespeare's immortal work Hamlet takes the stage at Istanbul State Theater with a modern interpretation. A contemporary adaptation of the classic work directed by Ahmet Levendoğlu.,Modern yorumlu Hamlet tiyatro oyunu,Hamlet theater play with modern interpretation,theater,drama,80.00,200.00,TRY,2024-07-20 19:30:00,2024-07-20 22:00:00,İstanbul Devlet Tiyatrosu,Beyoğlu/İstanbul,İstanbul,Turkey,41.0369,28.9850,,8,"{8}",https://devtiyatro.gov.tr/hamlet,İstanbul Devlet Tiyatrosu,info@devtiyatro.gov.tr,devtiyatro,DT2024002,https://devtiyatro.gov.tr/hamlet,false,true,680,42,"{""tiyatro"",""drama"",""shakespeare"",""hamlet"",""klasik""}","{""language"": ""Turkish"", ""duration"": ""150 minutes"", ""intermission"": true, ""age_limit"": ""12+"", ""subtitle"": false}",2024-01-15 13:05:00,2024-01-15 13:05:00
istanbul_jazz_festival,37. İstanbul Jazz Festivali,37th Istanbul Jazz Festival,Dünyanın önde gelen caz müzisyenlerini İstanbul'da ağırlayan festival bu yıl 37. kez düzenleniyor. 15 gün boyunca şehrin farklı mekanlarında 50'den fazla konser.,The festival hosting world's leading jazz musicians in Istanbul is being held for the 37th time this year. More than 50 concerts in different venues across the city for 15 days.,Dünya starlarının katıldığı jazz festivali,Jazz festival featuring world stars,festival,jazz,75.00,350.00,TRY,2024-07-01 19:00:00,2024-07-15 23:59:00,Çeşitli Mekanlar,İstanbul Çapında,İstanbul,Turkey,41.0082,28.9784,,9,"{9}",https://caz.iksv.org,İstanbul Kültür Sanat Vakfı,info@iksv.org,iksv,IKSV2024003,https://caz.iksv.org,true,true,2150,156,"{""festival"",""caz"",""müzik"",""uluslararası"",""istanbul""}","{""duration"": ""15 days"", ""venues_count"": 12, ""international_artists"": true, ""accessibility"": true, ""age_limit"": ""all ages""}",2024-01-15 13:10:00,2024-01-15 13:10:00
galatasaray_fenerbahce_derbi,Galatasaray vs Fenerbahçe Derbisi,Galatasaray vs Fenerbahce Derby,Türk futbolunun en büyük derbisi! Galatasaray ve Fenerbahçe arasında oynanacak kritik maç. Şampiyonluk yarışında önemli rol oynayacak karşılaşma.,The biggest derby of Turkish football! Critical match between Galatasaray and Fenerbahce. A match that will play an important role in the championship race.,Türk futbolunun en büyük derbisi,The biggest derby of Turkish football,sports,football,200.00,800.00,TRY,2024-04-21 19:00:00,2024-04-21 21:00:00,Türk Telekom Stadyumu,Seyrantepe/İstanbul,İstanbul,Turkey,41.1033,29.0000,,,"{10}",https://www.passo.com.tr/galatasaray-fenerbahce,Passolig,info@passolig.com.tr,passolig,PS2024004,https://www.passo.com.tr/galatasaray-fenerbahce,true,true,5200,320,"{""futbol"",""derbi"",""galatasaray"",""fenerbahçe"",""spor""}","{""home_team"": ""Galatasaray"", ""away_team"": ""Fenerbahçe"", ""league"": ""Süper Lig"", ""referee"": ""TBD"", ""tv_broadcast"": true}",2024-01-15 13:15:00,2024-01-15 13:15:00
rock_in_solo_fest,Rock'n Solo Festival 2024,Rock'n Solo Festival 2024,Türkiye'nin en büyük rock festivali 3 gün boyunca devam edecek. Dünyaca ünlü rock grupları ve Türk rock'ın önemli isimleri sahne alacak.,Turkey's biggest rock festival will continue for 3 days. World-famous rock bands and important names of Turkish rock will take the stage.,Türkiye'nin en büyük rock festivali,Turkey's biggest rock festival,festival,rock,180.00,650.00,TRY,2024-08-15 16:00:00,2024-08-17 23:59:00,Life Park,Bayrampaşa/İstanbul,İstanbul,Turkey,41.0500,28.9000,,,"{11}",https://www.biletino.com/rock-solo-festival,Biletino,info@biletino.com,biletino,BN2024005,https://www.biletino.com/rock-solo-festival,true,true,1850,128,"{""festival"",""rock"",""müzik"",""3-gün"",""kamp""}","{""duration"": ""3 days"", ""camping"": true, ""food_area"": true, ""age_limit"": ""16+"", ""stages_count"": 3}",2024-01-15 13:20:00,2024-01-15 13:20:00
istanbul_film_festivali,41. İstanbul Film Festivali,41st Istanbul Film Festival,Altın Lale ödüllerinin sahiplerini bulacağı festival dünya sinemasından seçkin örnekleri İstanbul sinemaseverlerle buluşturuyor.,The festival where Golden Tulip awards will find their owners brings distinguished examples from world cinema together with Istanbul cinema lovers.,Altın Lale ödüllü uluslararası film festivali,International film festival with Golden Tulip awards,festival,cinema,25.00,120.00,TRY,2024-10-05 10:00:00,2024-10-16 23:59:00,Çeşitli Sinemalar,İstanbul Çapında,İstanbul,Turkey,41.0082,28.9784,,,"{12}",https://film.iksv.org,İstanbul Kültür Sanat Vakfı,film@iksv.org,iksv,IKSV2024006,https://film.iksv.org,true,true,3200,89,"{""festival"",""sinema"",""film"",""uluslararası"",""altın-lale""}","{""duration"": ""12 days"", ""film_count"": 200, ""country_count"": 45, ""venues_count"": 15, ""awards"": true}",2024-01-15 13:25:00,2024-01-15 13:25:00
cem_adrian_akustik,Cem Adrian Akustik Konser,Cem Adrian Acoustic Concert,Cem Adrian'ın eşsiz sesiyle akustik bir gece. Sanatçının en sevilen şarkılarının akustik versiyonlarını dinleme fırsatı.,An acoustic night with Cem Adrian's unique voice. An opportunity to listen to acoustic versions of the artist's most beloved songs.,Cem Adrian'dan akustik bir gece,An acoustic night from Cem Adrian,music,acoustic,120.00,300.00,TRY,2024-05-18 20:30:00,2024-05-18 22:30:00,Zorlu PSM,Beşiktaş/İstanbul,İstanbul,Turkey,41.0600,29.0100,,,"{13}",https://www.zorlupsm.com/cem-adrian,Zorlu PSM,info@zorlupsm.com,zorlupsm,ZP2024007,https://www.zorlupsm.com/cem-adrian,false,true,920,67,"{""müzik"",""akustik"",""cem-adrian"",""konser"",""alternatif""}","{""seating"": ""theater style"", ""acoustic_setup"": true, ""duration"": ""120 minutes"", ""age_limit"": ""all ages""}",2024-01-15 13:30:00,2024-01-15 13:30:00
besiktas_olimpiakos_basketball,Beşiktaş vs Olympiakos - EuroLeague,Besiktas vs Olympiakos - EuroLeague,EuroLeague'de Beşiktaş'ın ev sahipliğinde oynayacağı kritik maç. Avrupa basketbolunun elit seviyesinde heyecan dolu mücadele.,Critical match that Besiktas will host in EuroLeague. Exciting competition at the elite level of European basketball.,EuroLeague'de kritik basketbol maçı,Critical basketball match in EuroLeague,sports,basketball,80.00,250.00,TRY,2024-03-14 20:00:00,2024-03-14 22:00:00,Akatlar Arena,Beşiktaş/İstanbul,İstanbul,Turkey,41.0700,29.0200,,,"{14}",https://www.biletix.com/besiktas-olimpiakos,Biletix,basketbol@biletix.com,biletix,BX2024008,https://www.biletix.com/besiktas-olimpiakos,false,true,780,45,"{""basketbol"",""euroleague"",""beşiktaş"",""olimpiakos"",""spor""}","{""home_team"": ""Beşiktaş"", ""away_team"": ""Olympiakos"", ""competition"": ""EuroLeague"", ""tv_broadcast"": true}",2024-01-15 13:35:00,2024-01-15 13:35:00 